{
  "name": "DALEXtra",
  "title": "Extension for 'DALEX' Package",
  "description": "Provides wrapper of various machine learning models. In applied machine learning, there is a strong belief that we need to strike a balance between interpretability and accuracy. However, in field of the interpretable machine learning, there are more and more new ideas for explaining black-box models, that are implemented in 'R'. 'DALEXtra' creates 'DALEX' Biecek (2018) <doi:10.48550/arXiv.1806.08915> explainer for many type of models including those created using 'python' 'scikit-learn' and 'keras' libraries, and 'java' 'h2o' library. Important part of the package is Champion-Challenger analysis and innovative approach to model performance across subsets of test data presented in Funnel Plot.",
  "repo_url": "https://github.com/ModelOriented/DALEXtra",
  "pkdown_url": "https://ModelOriented.github.io/DALEXtra",
  "bug_reports_url": "https://github.com/ModelOriented/DALEXtra/issues",
  "logo_url": "https://ModelOriented.github.io/DALEXtra/logo.png",
  "last_updated": "2026-01-14",
  "authors": [
    {
      "name": "Szymon Maksymiuk",
      "roles": [
        "aut",
        "cre"
      ],
      "orcid": "0000-0002-3120-1601",
      "email": "sz.maksymiuk@gmail.com"
    },
    {
      "name": "Przemyslaw Biecek",
      "roles": [
        "aut"
      ],
      "orcid": "0000-0001-8423-1823"
    },
    {
      "name": "Hubert Baniecki",
      "roles": [
        "aut"
      ]
    },
    {
      "name": "Anna Kozak",
      "roles": [
        "ctb"
      ],
      "directory_id": "anna-kozak"
    }
  ]
}
