{
  "name": "cherryblossom",
  "title": "Cherry Blossom Run Race Results",
  "description": "Race results of the Cherry Blossom Run, which is an annual road race that takes place in Washington, DC.",
  "repo_url": "https://github.com/OpenIntroStat/cherryblossom",
  "pkdown_url": null,
  "bug_reports_url": "https://github.com/OpenIntroStat/cherryblossom/issues",
  "logo_url": "https://raw.githubusercontent.com/OpenIntroStat/cherryblossom/HEAD/man/figures/logo.png",
  "last_updated": "2020-06-25",
  "authors": [
    {
      "name": "Mine Çetinkaya-Rundel",
      "roles": [
        "aut",
        "cre"
      ],
      "orcid": "0000-0001-6452-2420",
      "email": "cetinkaya.mine@gmail.com"
    }
  ]
}
