{
  "name": "FactoMineR",
  "title": "Multivariate Exploratory Data Analysis and Data Mining",
  "description": "Exploratory data analysis methods to summarize, visualize and describe datasets. The main principal component methods are available, those with the largest potential in terms of applications: principal component analysis (PCA) when variables are quantitative, correspondence analysis (CA) and multiple correspondence analysis (MCA) when variables are categorical, Multiple Factor Analysis when variables are structured in groups, etc. and hierarchical cluster analysis. F. Husson, S. Le and J. Pages (2017).",
  "repo_url": "https://github.com/husson/FactoMineR",
  "pkdown_url": "http://factominer.free.fr",
  "bug_reports_url": "https://github.com/husson/FactoMineR/issues",
  "logo_url": null,
  "last_updated": "2026-04-08",
  "authors": [
    {
      "name": "Francois Husson",
      "roles": [
        "aut",
        "cre"
      ],
      "orcid": "0000-0002-7271-8877",
      "email": "francois.husson@institut-agro.fr"
    },
    {
      "name": "Julie Josse",
      "roles": [
        "aut"
      ],
      "directory_id": "julie-josse"
    },
    {
      "name": "Sebastien Le",
      "roles": [
        "aut"
      ]
    },
    {
      "name": "Jeremy Mazet",
      "roles": [
        "aut"
      ]
    }
  ]
}
