{
  "name": "odbr",
  "title": "Download Data from Brazil's Origin Destination Surveys",
  "description": "Download data from Brazil's Origin Destination Surveys. The package covers both data from household travel surveys, dictionaries of variables, and the spatial geometries of surveys conducted in different years and across various urban areas in Brazil. For some cities, the package will include enhanced versions of the data sets with variables \"harmonized\" across different years.",
  "repo_url": "https://github.com/hsvab/odbr",
  "pkdown_url": "https://hsvab.github.io/odbr/",
  "bug_reports_url": "https://github.com/hsvab/odbr/issues",
  "logo_url": "https://hsvab.github.io/odbr/logo.png",
  "last_updated": "2025-02-14",
  "authors": [
    {
      "name": "Haydee Svab",
      "roles": [
        "aut",
        "cre"
      ],
      "directory_id": "haydee-svab",
      "email": "hsvab@hsvab.eng.br"
    },
    {
      "name": "Beatriz Milz",
      "roles": [
        "aut"
      ],
      "orcid": "0000-0002-3064-4486",
      "directory_id": "beatriz-milz"
    },
    {
      "name": "Diego Rabatone Oliveira",
      "roles": [
        "aut"
      ]
    },
    {
      "name": "Rafael H. M. Pereira",
      "roles": [
        "aut"
      ],
      "orcid": "0000-0003-2125-7465"
    }
  ]
}
